{
  "$schema": "http://json-schema.org/draft-07/schema#",
  "$id": "https://github.com/poetrasapoetra/ci4-template/blob/main/generator/schema.json",
  "title": "CI4-template generator base schema",
  "description": "Defines a generic MySQL table structure for generating CodeIgniter 4 models and migrations.",
  "type": "object",
  "required": ["name", "fields", "class_name"],
  "properties": {
    "$schema": {
      "type": "string",
      "description": "JSON Schema reference"
    },
    "name": {
      "type": "string",
      "pattern": "^[a-zA-Z_][a-zA-Z0-9_]*$",
      "description": "The name of the MySQL table"
    },
    "class_name": {
      "type": "string",
      "pattern": "^[A-Z][a-zA-Z0-9]*$",
      "description": "The name of the generated PHP class (PascalCase suggested)"
    },
    "fields": {
      "type": "array",
      "minItems": 1,
      "items": {
        "$ref": "#/$defs/field"
      },
      "description": "List of columns/fields for the table"
    },
    "primaryKey": {
      "type": "array",
      "items": {
        "type": "string"
      },
      "description": "List of column names composing the primary key"
    },
    "indexes": {
      "type": "array",
      "items": {
        "type": "object",
        "required": ["name", "fields"],
        "properties": {
          "name": {
            "type": "string",
            "description": "Name of the index"
          },
          "fields": {
            "type": "array",
            "items": { "type": "string" },
            "minItems": 1,
            "description": "List of field names included in the index"
          },
          "unique": {
            "type": "boolean",
            "default": false,
            "description": "Whether the index enforces uniqueness"
          }
        },
        "additionalProperties": false
      },
      "description": "List of additional indexes on the table"
    },
    "engine": {
      "type": "string",
      "enum": ["InnoDB", "MyISAM", "MEMORY", "CSV"],
      "default": "InnoDB",
      "description": "Storage engine for the table"
    },
    "charset": {
      "type": "string",
      "default": "utf8mb4",
      "description": "Character set for the table"
    },
    "collation": {
      "type": "string",
      "default": "utf8mb4_unicode_ci",
      "description": "Collation for the table"
    }
  },
  "additionalProperties": false,

  "$defs": {
    "field": {
      "oneOf": [
        {
          "type": "object",
          "required": ["name", "type"],
          "properties": {
            "name": {
              "type": "string",
              "pattern": "^[a-zA-Z_][a-zA-Z0-9_]*$",
              "description": "Column name"
            },
            "type": {
              "type": "string",
              "enum": [
                "INT",
                "BIGINT",
                "VARCHAR",
                "TEXT",
                "DATE",
                "DATETIME",
                "DECIMAL",
                "FLOAT",
                "DOUBLE",
                "BOOLEAN",
                "CHAR",
                "TIME",
                "TIMESTAMP",
                "JSON",
                "ENUM",
                "SET",
                "BLOB",
                "TINYINT",
                "SMALLINT",
                "MEDIUMINT",
                "BINARY"
              ],
              "description": "MySQL column type"
            },
            "length": {
              "type": ["integer", "null"],
              "description": "Length or precision of the column (if applicable)"
            },
            "unsigned": {
              "type": "boolean",
              "default": false,
              "description": "Whether the column is unsigned (for numeric types)"
            },
            "nullable": {
              "type": "boolean",
              "default": false,
              "description": "Whether the column is nullable"
            },
            "default": {
              "type": ["string", "number", "boolean", "null"],
              "description": "Default value for the column"
            },
            "auto_increment": {
              "type": "boolean",
              "default": false,
              "description": "Whether this is an auto-incrementing column"
            },
            "unique": {
              "type": "boolean",
              "default": false,
              "description": "Whether this column has a unique constraint"
            },
            "index": {
              "type": "boolean",
              "default": false,
              "description": "Whether this column is indexed"
            },
            "comment": {
              "type": "string",
              "description": "Optional comment about the column"
            },
            "charset": {
              "type": "string",
              "enum": ["utf8mb4", "latin1", "utf8", "ascii"],
              "description": "Character set for the table (case-insensitive, e.g. utf8mb4)"
            },
            "collation": {
              "type": "string",
              "enum": [
                "utf8mb4_bin",
                "utf8mb4_unicode_ci",
                "utf8_general_ci",
                "latin1_swedish_ci",
                "ascii_general_ci"
              ],
              "description": "Collation for the table (case-insensitive, e.g. utf8mb4_unicode_ci)"
            },
            "enums": {
              "type": "array",
              "items": { "type": "string" },
              "minItems": 2,
              "description": "Allowed values for enum type"
            }
          },
          "allOf": [
            {
              "if": {
                "properties": {
                  "type": {
                    "enum": ["VARCHAR", "CHAR", "BINARY", "VARBINARY"]
                  }
                }
              },
              "then": {
                "required": ["length"]
              }
            },
            {
              "if": {
                "properties": {
                  "type": { "const": "ENUM" }
                }
              },
              "then": {
                "required": ["enums"]
              }
            }
          ],
          "additionalProperties": false
        },
        {
          "type": "object",
          "required": ["preset"],
          "properties": {
            "preset": {
              "type": "string",
              "const": "ced_timestamp",
              "description": "Shortcut to add created_at, edited_at, and deleted_at fields"
            }
          }
        }
      ]
    }
  }
}
